"Qty";"Value";"Device";"Package";"Parts";"Description";"ARROW_PART_NUMBER";"ARROW_PRICE-STOCK";"DESCRIPTION";"HEIGHT";"MANUFACTURER";"MANUFACTURER_NAME";"MANUFACTURER_PART_NUMBER";"MOUSER_PART_NUMBER";"MOUSER_PRICE-STOCK";"PROD_ID";
"4";"";"BZX79-C16,113";"DIOAD1165W56L425D185";"Z1, Z2, Z5, Z6";"Nexperia Zener Diode, 16V +/-2 %, +/-5 % 500 mW Through Hole 2-Pin SOD27 (DO-35)";"";"";"Nexperia Zener Diode, 16V +/-2 %, +/-5 % 500 mW Through Hole 2-Pin SOD27 (DO-35)";"mm";"";"Nexperia";"BZX79-C16,113";"";"";"";
"2";"";"CONN_06SILK_FEMALE_PTH";"1X06";"J2, J13";"Multi connection point. Often used as Generic Header-pin footprint for 0.1 inch spaced/style header connections";"";"";"";"";"";"";"";"";"";"CONN-08437";
"6";"0.1u";"EMF212B7104KGHT";"CAPC2012X135N";"C21A, C21B, C21B2, C21B4, C21B6, C21D";"Multilayer Ceramic Capacitors MLCC - SMD/SMT 0805 16VDC 0.1uF 10% X7R AEC-Q200";"";"";"Multilayer Ceramic Capacitors MLCC - SMD/SMT 0805 16VDC 0.1uF 10% X7R AEC-Q200";"1.35mm";"";"TAIYO YUDEN";"EMF212B7104KGHT";"963-EMF212B7104KGHT";"https://www.mouser.co.uk/ProductDetail/Taiyo-Yuden/EMF212B7104KGHT?qs=%252B6g0mu59x7JRGtoE3odDgw%3D%3D";"";
"2";"0.1u, Ceramic Capacitor X7R";"EMF212B7104KGHT";"CAPC2012X135N";"C28A, C28A1";"Multilayer Ceramic Capacitors MLCC - SMD/SMT 0805 16VDC 0.1uF 10% X7R AEC-Q200";"";"";"Multilayer Ceramic Capacitors MLCC - SMD/SMT 0805 16VDC 0.1uF 10% X7R AEC-Q200";"1.35mm";"";"TAIYO YUDEN";"EMF212B7104KGHT";"963-EMF212B7104KGHT";"https://www.mouser.co.uk/ProductDetail/Taiyo-Yuden/EMF212B7104KGHT?qs=%252B6g0mu59x7JRGtoE3odDgw%3D%3D";"";
"2";"0.1uF, 35V";"MKS4B031002A00JC00";"MKS4B031002A00JC00";"C2O, C2O1";"Film Capacitors MKS 4 0.1 uF 50 VDC 2.5x7x10 PCM 7.5";"";"";"Film Capacitors MKS 4 0.1 uF 50 VDC 2.5x7x10 PCM 7.5";"7mm";"";"WIMA";"MKS4B031002A00JC00";"505-MKS4B0312AJC";"https://www.mouser.co.uk/ProductDetail/WIMA/MKS4B031002A00JC00?qs=2G4irm%2FqADy9MV8AUfKNYA%3D%3D";"";
"2";"100k";"PR02000201003JA1000411/15";"0411/15";"R5P, R5P1";"Vishay PR02 Series Axial Metal Film Fixed Resistor 100k +/-5% 2W +/-250ppm/C";"";"";"Vishay PR02 Series Axial Metal Film Fixed Resistor 100k +/-5% 2W +/-250ppm/C";"mm";"";"Vishay";"PR02000201003JA100";"594-5083NW100K0JA100";"https://www.mouser.co.uk/ProductDetail/Vishay-BC-Components/PR02000201003JA100?qs=T%2FnZg7%2FCwxPef%2F94FLP9PA%3D%3D";"";
"8";"100uF";"UFW1H101MPD1TD";"CAPPRD350W60D825H1300";"C11O, C12O, C13O, C14O, C15O, C24O, C25O, C26O";"Aluminum Electrolytic Capacitors - Radial Leaded 100uF 50 Volts 20%";"UFW1H101MPD1TD";"https://www.arrow.com/en/products/ufw1h101mpd1td/nichicon";"Aluminum Electrolytic Capacitors - Radial Leaded 100uF 50 Volts 20%";"13mm";"";"Nichicon";"UFW1H101MPD1TD";"647-UFW1H101MPD1TD";"https://www.mouser.co.uk/ProductDetail/Nichicon/UFW1H101MPD1TD?qs=WJSLByB5Mu30jPPJ2KiG3A%3D%3D";"";
"10";"10k";"LR1F10K";"0207/10";"R11O, R19O, R20O, R20O1, R20O2, R21O, R22O, R28O, R29O, R30O";"Metal film resistor, 10K 0.6W TE Connectivity LR1F Series Axial Metal Film Resistor 10k";"";"";"Metal film resistor, 10K 0.6W TE Connectivity LR1F Series Axial Metal Film Resistor 10k";"mm";"";"TE Connectivity";"LR1F10K";"279-LR1F10K";"https://www.mouser.co.uk/ProductDetail/TE-Connectivity-Holsworthy/LR1F10K?qs=ip69W3eHERWDLLWs2Qv0Lg%3D%3D";"";
"6";"10u";"EMK212BB7106KG-T";"CAPC2012X135N";"C20A, C20B, C20B2, C20B4, C20B6, C20D";"Multilayer Ceramic Capacitors MLCC - SMD/SMT 10uF 16V X7R 10% 0805";"";"";"Multilayer Ceramic Capacitors MLCC - SMD/SMT 10uF 16V X7R 10% 0805";"1.35mm";"";"TAIYO YUDEN";"EMK212BB7106KG-T";"963-EMK212BB7106KG-T";"https://www.mouser.co.uk/ProductDetail/TAIYO-YUDEN/EMK212BB7106KG-T?qs=vF%252B8ahGVilemLVRka0hELA%3D%3D";"";
"4";"15k";"CPF215K000FKE14";"0411/15";"R5, R11, R19, R20";"VISHAY - CPF215K000FKE14 - Through Hole Resistor, 15 kohm, CPF Series, 2 W, +/- 1%, Axial Leaded, 500 V";"";"";"VISHAY - CPF215K000FKE14 - Through Hole Resistor, 15 kohm, CPF Series, 2 W, +/- 1%, Axial Leaded, 500 V";"mm";"";"Vishay";"CPF215K000FKE14";"71-CPF2-F-15K-E3";"https://www.mouser.com/ProductDetail/71-CPF2-F-15K-E3";"";
"8";"182";"MF0207FTE52-182R";"0207/10";"R12O, R14O, R16O, R18O, R23O, R24O, R25O, R26O";"Metal Film Resistors - Through Hole 0.6W 1% 182 ohm 50pp m";"";"";"Metal Film Resistors - Through Hole 0.6W 1% 182 ohm 50pp m";"mm";"Yageo";"";"MF0207FTE52-182R";"603-MF0207FTE52-182R";"https://www.mouser.com/ProductDetail/YAGEO/MF0207FTE52-182R?qs=KUIzHt%2Fe91leK267FaM40g%3D%3D";"";
"2";"1935200";"1935200";"1935200";"J7, J9";"Fixed Terminal Blocks PT 1.5/6-5.0-H";"";"";"Fixed Terminal Blocks PT 1.5/6-5.0-H";"11.55mm";"";"Phoenix Contact";"1935200";"651-1935200";"https://www.mouser.co.uk/ProductDetail/Phoenix-Contact/1935200?qs=8BCRtFWWXOTOyOTMiNRITA%3D%3D";"";
"2";"1935255";"1935255";"1935255";"J4, J6";"Phoenix Contact PT 1.5/11-5.0-H PCB Terminal Block, 11 Way/Pole, Screw Terminals, 26  14 AWG Through Hole,";"";"";"Phoenix Contact PT 1.5/11-5.0-H PCB Terminal Block, 11 Way/Pole, Screw Terminals, 26  14 AWG Through Hole,";"11.55mm";"";"Phoenix Contact";"1935255";"651-1935255";"https://www.mouser.co.uk/ProductDetail/Phoenix-Contact/1935255?qs=wd%252Bw3mUqFrm1E513uD0TOQ%3D%3D";"";
"2";"1M*";"LR1F1M0";"0207/10";"R3O, R3O1";"TE Connectivity Axial Metal Film Resistor 1m +/-1% 0.6W +/-50ppm/C";"";"";"TE Connectivity Axial Metal Film Resistor 1m +/-1% 0.6W +/-50ppm/C";"mm";"";"TE Connectivity";"LR1F1M0";"279-LR1F1M0";"https://www.mouser.co.uk/ProductDetail/TE-Connectivity-Holsworthy/LR1F1M0?qs=ip69W3eHERVt%2FmQVAugcSg%3D%3D";"";
"16";"1N4007FFG";"1N4007FFG";"DIOAD1405W86L465D235";"D7, D8, D9, D10, D11, D12, D13, D14, D15, D16, D17, D18, D19, D20, D21, D22";"Rectifiers 1000V 1A Standard";"";"";"Rectifiers 1000V 1A Standard";"mm";"";"onsemi";"1N4007FFG";"863-1N4007FFG";"https://www.mouser.co.uk/ProductDetail/onsemi/1N4007FFG?qs=y2kkmE52mdPFE87Rxbyfgw%3D%3D";"";
"6";"1N4148-T50R";"1N4148-T50R";"DIOAD1068W53L380D172";"D1, D2, D3, D4, D5, D6";"Diodes - General Purpose, Power, Switching Hi Conductance Fast";"";"";"Diodes - General Purpose, Power, Switching Hi Conductance Fast";"mm";"";"onsemi";"1N4148-T50R";"512-1N4148T50R";"https://www.mouser.co.uk/ProductDetail/onsemi-Fairchild/1N4148-T50R?qs=0lQeLiL1qyZS6rosZp7Ehg%3D%3D";"";
"2";"1N750";"1N750";"DIOAD1256W56L444D203";"Z3, Z4";"Zener Diodes Voltage Regulator";"";"";"Zener Diodes Voltage Regulator";"mm";"";"Microsemi Corporation";"1N750";"494-1N750(DO-35)";"https://www.mouser.co.uk/ProductDetail/Microchip-Microsemi/1N750?qs=Xwz%252BGKGy4sB1rzIdx4SmVg%3D%3D";"";
"6";"1k";"CHP0805-FX-1001ELF";"RESC2012X60N";"R6A, R6B, R6B2, R6B4, R6B6, R6D";"BOURNS - CHP0805-FX-1001ELF - SMD Chip Resistor, 0805 [2012 Metric], 1 kohm, CHP Series, 200 V, Thick Film, 500 mW";"";"";"BOURNS - CHP0805-FX-1001ELF - SMD Chip Resistor, 0805 [2012 Metric], 1 kohm, CHP Series, 200 V, Thick Film, 500 mW";"0.6mm";"";"Bourns";"CHP0805-FX-1001ELF";"652-CHP0805FX1001ELF";"https://www.mouser.co.uk/ProductDetail/Bourns/CHP0805-FX-1001ELF?qs=lc2O%252BfHJPVYkHmuBCgSoNQ%3D%3D";"";
"8";"1k";"LR1F1K0";"0207/10";"R1, R2, R3, R4, R7, R8, R13, R14";"Body Features: Lead Type Axial-Leaded | Configuration Features: Number of Resistors 1 | Dimensions: Passive Component Dimensions 6.2 x 2.3 MM | Electrical Characteristics: Passive Component Tolerance 1 PCT | Resistance Value 1K OHM | Operating Voltage 350 V | Power Rating .6 WATT | Resistance Class 1k  1M | Packaging Features: Packaging Method Ammo Packed | Product Type Features: Element Type Thin Film | Resistor Type General Purpose Resistor | Termination Features: Termination Area Base Material Cop";"";"";"Body Features: Lead Type Axial-Leaded | Configuration Features: Number of Resistors 1 | Dimensions: Passive Component Dimensions 6.2 x 2.3 MM | Electrical Characteristics: Passive Component Tolerance 1 PCT | Resistance Value 1K OHM | Operating Voltage 350 V | Power Rating .6 WATT | Resistance Class 1k  1M | Packaging Features: Packaging Method Ammo Packed | Product Type Features: Element Type Thin Film | Resistor Type General Purpose Resistor | Termination Features: Termination Area Base Material Cop";"mm";"";"TE Connectivity";"LR1F1K0";"279-LR1F1K0";"https://www.mouser.co.uk/ProductDetail/TE-Connectivity-Holsworthy/LR1F1K0?qs=ip69W3eHERVhMxNSZkerTg%3D%3D";"";
"6";"200k";"RR1220P-204-D";"R0805";"R8A, R8B, R8B2, R8B4, R8B6, R8D";"RESISTOR, 0805 200 KOhm +/- 0.5% 0.1 W";"";"";"RESISTOR, 0805 200 KOhm +/- 0.5% 0.1 W";"mm";"";"Susumu";"RR1220P-204-D";"754-RR1220P-204D";"https://www.mouser.com/Search/Refine.aspx?Keyword=754-RR1220P-204D";"";
"4";"220";"PR02000202200JA1000411/15";"0411/15";"R2P, R2P1, R3P, R3P1";"Vishay PR02 Series Axial Metal Film Fixed Resistor 220 +/-5% 2W +/-250ppm/C";"";"";"Vishay PR02 Series Axial Metal Film Fixed Resistor 220 +/-5% 2W +/-250ppm/C";"mm";"";"Vishay";"PR02000202200JA100";"594-5083NW220R0JA100";"https://www.mouser.com/ProductDetail/594-5083NW220R0JA100";"";
"6";"22u";"EMK316BB7226ML-T";"C1206";"C19A, C19B, C19B2, C19B4, C19B6, C19D";"Multilayer Ceramic Capacitors MLCC - SMD/SMT 22uF 16V X7R +/-20% 1206 Gen Purp";"";"";"Multilayer Ceramic Capacitors MLCC - SMD/SMT 22uF 16V X7R +/-20% 1206 Gen Purp";"1.8mm";"";"TAIYO YUDEN";"EMK316BB7226ML-T";"963-EMK316BB7226ML-T";"https://www.mouser.co.uk/ProductDetail/TAIYO-YUDEN/EMK316BB7226ML-T?qs=EPmvyOv1YlPvyo1ebMxtFg%3D%3D";"";
"2";"249";"MBB02070C2490FRP00";"0207/10";"R9, R15";"Metal Film Resistors - Through Hole 249ohm 1% 0.6W Metal Film Resistor";"";"";"Metal Film Resistors - Through Hole 249ohm 1% 0.6W Metal Film Resistor";"mm";"";"VISHAY";"MBB02070C2490FRP00";"";"";"";
"2";"300k";"PR02000203003JR5000411/15";"0411/15";"R4P, R4P1";"Vishay PR0200 Series Axial Metal Film Fixed Resistor 300k +/-5% 2W +/-250ppm/K";"";"";"Vishay PR0200 Series Axial Metal Film Fixed Resistor 300k +/-5% 2W +/-250ppm/K";"mm";"";"Vishay";"PR02000203003JR500";"594-5083NW300K0J";"https://www.mouser.co.uk/ProductDetail/Vishay-BC-Components/PR02000203003JR500?qs=LCMWAU1DZcy5bcFmrSgb2A%3D%3D";"";
"2";"30uF/400V";"DCP4G056007GD4KSSD";"DCP4G056007GD4KSSD";"C21O, C21O1";"Metallized Polypropylene Capacitor";"";"";"Metallized Polypropylene Capacitor";"39.5mm";"";"WIMA";"DCP4G056007GD4KSSD";"505-DCP4G056007GD4KS";"https://www.mouser.co.uk/ProductDetail/WIMA/DCP4G056007GD4KSSD?qs=RB4whv9F6ryIMjVzuPTkgw%3D%3D";"";
"4";"330";"PR02000203300JA1000411/15";"0411/15";"R6P, R6P1, R6P2, R6P3";"Vishay PR02 Series Axial Metal Film Fixed Resistor 330 +/-5% 2W +/-250ppm/C";"";"";"Vishay PR02 Series Axial Metal Film Fixed Resistor 330 +/-5% 2W +/-250ppm/C";"mm";"";"Vishay";"PR02000203300JA100";"594-5083NW330R0JA100";"https://www.mouser.co.uk/ProductDetail/Vishay-BC-Components/PR02000203300JA100?qs=Dh5jukcGX2ziou5E5xaogg%3D%3D";"";
"6";"33k";"CPF0805B51KE1";"R0805";"R7A, R7B, R7B2, R7B4, R7B6, R7D";"NEOHM - TE CONNECTIVITY - CPF0805B51KE1 - SMD Chip Resistor, 51 kohm, +/- 0.1%, 100 mW, 0805 [2012 Metric], Thin Film, Precision Low TCR";"";"";"NEOHM - TE CONNECTIVITY - CPF0805B51KE1 - SMD Chip Resistor, 51 kohm, +/- 0.1%, 100 mW, 0805 [2012 Metric], Thin Film, Precision Low TCR";"0.65mm";"";"TE Connectivity";"CPF0805B51KE1";"279-CPF0805B51KE1";"https://www.mouser.co.uk/ProductDetail/TE-Connectivity-Holsworthy/CPF0805B51KE1?qs=iJVBkmKXgrkfOCLIw017vA%3D%3D";"";
"6";"4.7u";"EMK212ABJ475KG-T";"CAPC2013X140N";"C18A, C18B, C18B2, C18B4, C18B6, C18D";"Taiyo Yuden 4.7uF Multilayer Ceramic Capacitor MLCC 16V dc +/-10% X5R Dielectric 0805 SMD, Max. Temp. +85C";"";"";"Taiyo Yuden 4.7uF Multilayer Ceramic Capacitor MLCC 16V dc +/-10% X5R Dielectric 0805 SMD, Max. Temp. +85C";"1.4mm";"";"TAIYO YUDEN";"EMK212ABJ475KG-T";"963-EMK212ABJ475KG-T";"https://www.mouser.co.uk/ProductDetail/Taiyo-Yuden/EMK212ABJ475KG-T?qs=Va%252BXcMGJzEtDqSLhA2RQmA%3D%3D";"";
"4";"4.7u, Ceramic Capacitor X7R";"EMK212ABJ475KG-T";"CAPC2013X140N";"C26A, C26A1, C27A, C27A1";"Taiyo Yuden 4.7uF Multilayer Ceramic Capacitor MLCC 16V dc +/-10% X5R Dielectric 0805 SMD, Max. Temp. +85C";"";"";"Taiyo Yuden 4.7uF Multilayer Ceramic Capacitor MLCC 16V dc +/-10% X5R Dielectric 0805 SMD, Max. Temp. +85C";"1.4mm";"";"TAIYO YUDEN";"EMK212ABJ475KG-T";"963-EMK212ABJ475KG-T";"https://www.mouser.co.uk/ProductDetail/Taiyo-Yuden/EMK212ABJ475KG-T?qs=Va%252BXcMGJzEtDqSLhA2RQmA%3D%3D";"";
"2";"402";"RWR80S4020FRB12";"0617/22";"R17, R18";"Metal Film Resistors - Through Hole 402 OHM 2W 1%";"";"";"Metal Film Resistors - Through Hole 402 OHM 2W 1%";"mm";"";"VISHAY";"RWR80S4020FRB12";"";"";"";
"24";"68u";"500HXW68MEFR14.5X45";"CAPPRD750W80D1475H4700";"C1P, C1P1, C1P2, C1P3, C2P, C2P1, C2P2, C2P3, C3P, C3P1, C3P2, C3P3, C5P, C5P1, C5P2, C5P3, C6P, C6P1, C6P2, C6P3, C7P, C7P1, C7P2, C7P3";"Aluminum Electrolytic Capacitors - Radial Leaded GENERAL PURPOSE ELECTROLYTIC CAPACITORS";"";"";"Aluminum Electrolytic Capacitors - Radial Leaded GENERAL PURPOSE ELECTROLYTIC CAPACITORS";"47mm";"";"Rubycon";"500HXW68MEFR14.5X45";"232-500HXW68MEFR145X";"https://www.mouser.com/ProductDetail/Rubycon/500HXW68MEFR14.5X45?qs=T3oQrply3y9UkankbpWbTw%3D%3D";"";
"2";"76.8";"YR1B76R8CC";"0207/10";"R10, R16";"Body Features: Lead Type Axial-Leaded | Configuration Features: Number of Resistors 1 | Dimensions: Passive Component Dimensions 6.3 x 2.3 MM | Electrical Characteristics: Resistance Class Up to 1k | Power Rating .25 WATT | Operating Voltage 250 V | Passive Component Tolerance .1 PCT | Resistance Value 76.8 OHM | Packaging Features: Packaging Method Ammo Packed | Product Type Features: Resistor Type Precision Resistor | Element Type Thin Film | Termination Features: Number of Terminations 2 | Termination";"";"";"Body Features: Lead Type Axial-Leaded | Configuration Features: Number of Resistors 1 | Dimensions: Passive Component Dimensions 6.3 x 2.3 MM | Electrical Characteristics: Resistance Class Up to 1k | Power Rating .25 WATT | Operating Voltage 250 V | Passive Component Tolerance .1 PCT | Resistance Value 76.8 OHM | Packaging Features: Packaging Method Ammo Packed | Product Type Features: Resistor Type Precision Resistor | Element Type Thin Film | Termination Features: Number of Terminations 2 | Termination";"mm";"";"TE Connectivity";"YR1B76R8CC";"";"";"";
"2";"LM1117MPX-5.0_NOPB";"LM1117MPX-5.0_NOPB";"SOT230P700X180-4N";"IC3, IC4";"Space saving 800-mA low-dropout linear regulator with internal current limit";"";"";"Space saving 800-mA low-dropout linear regulator with internal current limit";"1.8mm";"";"Texas Instruments";"LM1117MPX-5.0/NOPB";"926-LM1117MPX5.0NOPB";"https://www.mouser.co.uk/ProductDetail/Texas-Instruments/LM1117MPX-5.0-NOPB?qs=X1J7HmVL2ZE1O12Qsl7F9g%3D%3D";"";
"2";"LM317MTG";"LM317MTG";"TO254P482X997X2018-3P";"U1, U2";"Internal Short Circuit Current Limiting; Internal Thermal Overload Protection; Output Current in Excess of 500 mA; Output Transistor Safe-Area Compensation; Output Adjustable between 1.2 V and 37 V; Floating Operation for High Voltage Applications; Eliminates Stocking Many Fixed Voltages; Pb-Free Packages are Available; NCV Prefix for Automotive and Other Applications Requiring Site Control Changes";"";"";"Internal Short Circuit Current Limiting, Internal Thermal Overload Protection, Output Current in Excess of 500 mA, Output Transistor Safe-Area Compensation, Output Adjustable between 1.2 V and 37 V, Floating Operation for High Voltage Applications, Pb-Free Packages are Available";"4.82mm";"";"onsemi";"LM317MTG";"863-LM317MTG";"https://www.mouser.co.uk/ProductDetail/onsemi/LM317MTG?qs=2OtswVQKCOHbXYkL9fERIw%3D%3D";"";
"2";"LP5907-1.8V";"LP5907-1.8V";"SOT95P280X145-5N";"LDO1, LDO7";"250-mA ultra-low-noise low-IQ low-dropout (LDO) linear regulator";"LP5907MFX-1.8/NOPB";"https://www.arrow.com/en/products/lp5907mfx-1.8nopb/texas-instruments?region=nac";"250-mA ultra-low-noise low-IQ low-dropout (LDO) linear regulator";"1.45mm";"";"Texas Instruments";"LP5907MFX-1.8/NOPB";"595-LP5907MFX-1.8NPB";"https://www.mouser.co.uk/ProductDetail/Texas-Instruments/LP5907MFX-1.8-NOPB?qs=biyDIajrTn5jh5ArkSZeqw%3D%3D";"";
"6";"LT3042";"LT3042";"SOP50P490X110-11N";"IC1, IC2, IC5, IC6, IC8, IC10";"LINEAR TECHNOLOGY - LT3042EMSE#PBF - LDO, ADJ, 0.2A, 0V-15V, MSOP-10";"";"";"LINEAR TECHNOLOGY - LT3042EMSE#PBF - LDO, ADJ, 0.2A, 0V-15V, MSOP-10";"1.1mm";"";"Linear Technology";"LT3042EMSE#PBF";"584-LT3042EMSE#PBF";"https://www.mouser.co.uk/ProductDetail/Analog-Devices-Linear-Technology/LT3042EMSEPBF?qs=oahfZPh6IAJ3XP16d20ITw%3D%3D";"";
"4";"MKP4G034705D00KSSD";"MKP4G034705D00KSSD";"MKP4G034705D00KSSD";"C1, C2, C3, C4";"0.47 F Film Capacitor 220V 400V Polypropylene (PP), Metallized Radial";"";"";"0.47 F Film Capacitor 220V 400V Polypropylene (PP), Metallized Radial";"16.5mm";"";"WIMA";"MKP4G034705D00KSSD";"505-MKP4G034705DKSSD";"http://www.mouser.com/Search/ProductDetail.aspx?qs=sJjjjplDs9uaOctv9bTMfA%3d%3d";"";
"1";"SJ-63033A";"SJ-63033A";"SJ63033A";"J3";"6.35 mm, Stereo, Right Angle, Through Hole Mount, 3 Conductors, 0 Internal Switches, Audio Jack Connector";"";"";"6.35 mm, Stereo, Right Angle, Through Hole Mount, 3 Conductors, 0 Internal Switches, Audio Jack Connector";"12.3mm";"";"CUI Devices";"SJ-63033A";"";"";"";
"4";"TCM1A106M8R";"TCM1A106M8R";"CAPPM168X90N";"C5, C6, C7, C8";"Tantalum Capacitors - Solid SMD 10 VDC 10 uF 0603 20 % ESR=9 mOhms";"";"";"Tantalum Capacitors - Solid SMD 10 VDC 10 uF 0603 20 % ESR=9 mOhms";"0.9mm";"";"Kyocera AVX";"TCM1A106M8R";"755-TCM1A106M8R";"https://www.mouser.co.uk/ProductDetail/KYOCERA-AVX/TCM1A106M8R?qs=Z4wLSx0Y7o51yvfoDMdJcQ%3D%3D";"";
"2";"UCY2E220MPD1TD";"UCY2E220MPD1TD";"CAPPRD500W60D1025H1750";"C4P, C4P1";"Aluminum Electrolytic Capacitors - Radial Leaded 22uF 250V 20% AEC-Q200";"";"";"Aluminum Electrolytic Capacitors - Radial Leaded 22uF 250V 20% AEC-Q200";"17.5mm";"";"Nichicon";"UCY2E220MPD1TD";"647-UCY2E220MPD1TD";"https://www.mouser.co.uk/ProductDetail/Nichicon/UCY2E220MPD1TD?qs=JgOBn5pVFooNXIGMeLbPFg%3D%3D";"";
"4";"VT9-PT";"VT9-PT";"VT9-PT";"SX1, SX2, SX3, SX4";"VACUUM TUBE SOCKET";"";"";"";"";"";"";"";"";"";"";
"6";"XR2A-0811-N";"XR2A-0811-N";"DIPS762W51P254L1016H390Q8N";"J1, J5, J8, J10, J12, J17";"IC & Component Sockets Socket DIP Term 8P 7.62mm .25AuPlate";"XR2A-0811-N";"https://www.arrow.com/en/products/xr2a-0811-n/omron?region=nac";"IC & Component Sockets Socket DIP Term 8P 7.62mm .25AuPlate";"3.9mm";"";"Omron Electronics";"XR2A-0811-N";"653-XR2A-0811-N";"https://www.mouser.co.uk/ProductDetail/Omron-Electronics/XR2A-0811-N?qs=WOBxwZpV8jWLu7CcbwkK0Q%3D%3D";"";
